<?xml version="1.0"?>
<dds xmlns:xsi="http://www.w3.org/2001/XMLSchema-instance"
     xsi:noNamespaceSchemaLocation="shapes_demo_configuration.xsd">
   <rti_shapes_demo>
     <domainId>0</domainId>
     <domainTag></domainTag>
     <participantPartitions></participantPartitions>
     <welcomeScreen>true</welcomeScreen>
     <popupConfig>false</popupConfig>
     <initialPeers></initialPeers>
      <qos>
        <file load="true">RTI_SHAPES_DEMO_QOS_PROFILES.xml</file>
       </qos>
   </rti_shapes_demo>
 </dds>
